title,url,summary
A century-old Argentine tradition,http://www.bbc.com/travel/story/20200303-the-iconic-buenos-aires-art-form-that-almost-disappeared,"For nearly a century, fileteado has been making the streets of the Argentine capital ever more vibrant and is now a trademark just as important as tango."
Japan’s last female pearl-divers,http://www.bbc.com/travel/story/20200228-japans-last-female-ama-pearl-divers,"The tradition of Japanese freediving has been passed down through generations of women since the 8th Century. Now, it is at risk of disappearing."
From 'hell' to beacon of sustainability,http://www.bbc.com/travel/story/20200223-is-gothenburg-europes-greenest-city,"For three years in a row, Sweden's second-largest city has been declared the world's most sustainable destination."
Japan's 'naked' festival of the gods,http://www.bbc.com/travel/story/20200220-japans-naked-festival-of-the-gods,"For more than 1,000 years, people in Chiba have honoured Japan's eight-million gods by carrying them out to sea as part of a Hadaka Matsuri (""naked festival"")."
A mysterious ode to the Knights Templar,http://www.bbc.com/travel/story/20200220-the-mysterious-inverted-tower-steeped-in-templar-myth,"At the heart of Sintra's Quinta da Regaleira, a breath-taking initiation well celebrates Portugal's unique historical connection to the mysterious Knights Templar."
The US’ little-known subculture,http://www.bbc.com/travel/story/20200216-baltimores-celebration-of-working-class-glamour,“Hons” have become one of Baltimore’s most prominent mascots – but the subculture's roots can be traced to humble beginnings.
What makes this country so happy?,http://www.bbc.com/travel/story/20200209-what-makes-vanuatu-one-of-the-happiest-places-in-the-world,"Despite being prone to natural disasters, this Pacific archipelago's unique combination of sustainability and tradition makes it one of the happiest places in the world."
The artefacts hidden from the Taliban,http://www.bbc.com/travel/story/20200203-the-afghan-artefacts-that-survived-taliban-destruction,"After thousands of priceless artefacts were smashed by Taliban forces, the country’s National Museum is piecing the fragments back together and hopes to unveil them this year."
